image_name,ocr_text,source_file
training_image_20260319_183028.jpg,今わしの見ている先に 怪しげに光る祠のようなものが見えるな？,zelda_core.py
training_image_20260319_183043.jpg,あれは塔が地面からせり出したのと同時に あのように光り始めたのじや,zelda_core.py
training_image_20260319_183053.jpg,ああいう場所には たいがいお宝が眠っておるものよ,zelda_core.py
training_image_20260319_183101.jpg,パラセールが欲しいのじゃろう？ お宝しみにしておるぞ,zelda_core.py
training_image_20260319_183133.jpg,チチそつくなるるしま とても不安定な状態で 何か刺激を与えると変化するしい チュチュゼリー,zelda_core.py
training_image_20260319_183148.jpg,中央のパルが光る不思議な板 初めて見る物のに何だか懐かし シーカーストーン,zelda_core.py
